{
  "aggregate_results_persisted_at_utc": null,
  "authorized_season": "2025-26",
  "benchmark_sha256": "a7308fff85e3e0aa45df13fc686940138c3b5dab1bd8b73ad0f15e400abff218",
  "code_sha256": {
    "dependency_versions": {
      "joblib": "1.6.0",
      "nba_api": "1.11.4",
      "numpy": "2.2.6",
      "pandas": "2.3.3",
      "pyarrow": "25.0.1",
      "scikit-learn": "1.7.2",
      "scipy": "1.15.3",
      "threadpoolctl": "3.7.0"
    },
    "dependency_versions_sha256": "7ac7f28fd801978c0072a439a5553586f04a03c073e23e08fed108d7ed3812f5",
    "executor": {
      "stage6/run.py": "810edad92838de387945d6385682b3c76e54c098e975c6339086989eb75aef92",
      "stage6/runtime.py": "39f86dd93762371ff99ce9e76f1b6d66968998bf3b64a21aab9ba7ff8616d7eb",
      "stage6/test_preflight.py": "96a8a47eef9a19fc890100ebb5f27ced7a884b86e09c18ccd6f8b91d562fa93a"
    },
    "historical": {
      ".venv/lib/python3.10/site-packages/sports_analytics_development_policy.pth": "11c7120ebfe2ee940ff7b6078cebc8d4cd126247db7ffffc05838270228998db",
      "scripts/audit_2023_24_features.py": "618f1da497ec01200be93ca3f2fe858f789d3790508c743f8d903084e8cf6d30",
      "scripts/build_2023_24_features.py": "eeff477d5d73b747f30665c9deaf2b862459274f71d6e0977ca9f256d6296272",
      "scripts/build_2023_24_games.py": "7c0eaa588e08d05cab42eb76e613e0452b328023ce100e01141ef6948761930d",
      "scripts/build_multi_season_games.py": "44da343e6c3f3d463cf275718c25430c68da29df590e4ffc300f169501ddf800",
      "scripts/build_reconciled_multiseason.py": "327982fd75fa459604d6afab943cbe0507a37e038b8164aabd125b2e3d2e2762",
      "scripts/build_season_games.py": "508924b7ff74402b9a2400a6b55ff42195fa8fa5380604fa4408c17fdc4cce90",
      "scripts/check_nba_access.py": "bcf07d55fd9d06994dafdde663e101155771deaa60f7ec1aaffcfa42e07b819f",
      "scripts/run_stage2_baselines.py": "058830b3c2307f0556d598a11cbbfe2a606a58269f6d55fe6b4f962d8305f89f",
      "scripts/run_stage3_logistic.py": "6d265a28dbbc33597f9978284c751d26b0f783c5ea65717e343826ffbaae08f6",
      "scripts/run_stage4_boosting.py": "34cfd6595ea4b136f0eb6f135483ccb63579e6cf348ae840517135aec3ad9938",
      "scripts/run_stage4a_verification.py": "86885520e62f9790337ae55f52e1c8d1ef8f02f0b4b6ebdc20a32fb314e44340",
      "scripts/run_stage5_preholdout.py": "ac2a933727dc0b50d30039ef5addb7053be264edfdff31fa31d01c061e258dc4",
      "scripts/run_stage5a_verification.py": "98173dd572b2067a8efbcdab90ff62f6dfa11cbec0465d5c676760fe6465ef15",
      "src/nba_game_prediction/__init__.py": "71c8cbde8a38b775ab625c98c4dd352767568ddb5787774e23fe973cc1ae1c4c",
      "src/nba_game_prediction/boosting.py": "a277ee4ea23d68522d55d3131181789eeef60e37253a24e4468d6103fbb4e6ba",
      "src/nba_game_prediction/elo.py": "6aa5e844368e1310088f01dd99c0c26b33562c8bd99c95a6ce5ea7eae378b2d1",
      "src/nba_game_prediction/evaluation.py": "94ef9537895bdfa5c5fc562becb23c93b9c3ce4921bafdf6f96ca63280cf394b",
      "src/nba_game_prediction/feature_io.py": "f9b29ab773a3df385b4ec417b57d2f5a3dad173bdb87f9190a972dcf45bb82cd",
      "src/nba_game_prediction/features.py": "8670014adfe8227c6f9ab998d824c2940e1fb67daa827e0acb95b5d79b30ad55",
      "src/nba_game_prediction/ingest.py": "76fdaefd6fb77140533cb55285727cc2e6fb2bfcaba5f0410ee25a70dd36e588",
      "src/nba_game_prediction/logistic.py": "a12260bd6dcb904753eec83dd431064a9b6705c525c5fbe6d3cc137029b2ddd6",
      "src/nba_game_prediction/metrics.py": "422c56f984db07af914d7725e379a97f0a01bf4f62e96dac130db426fdec0985",
      "src/nba_game_prediction/model_selection.py": "fbd8a358fbe11f3c7f45f919cc1179a4b303e7f20f48119d887dec2652ae3f15",
      "src/nba_game_prediction/modeling_data.py": "933187e61182593221799d0739f34fb9d6e21897fd90f9d63457844faded1d1e",
      "src/nba_game_prediction/multiseason.py": "1e3e1310b76107b69837b0e4cc7642f4f3b2df897f551cb80a2aab2c092e3a2a",
      "src/nba_game_prediction/normalize.py": "eb9734cabf8e7084790da2d421fb5cac316687ddddc87534ea00c34711da9e76",
      "src/nba_game_prediction/policy.py": "2c99731ca8a3ef4a75d2cd8d252206d5a162a55495fc972fea929efb849167f7",
      "src/nba_game_prediction/reconciliation.py": "f358f1caaaa1929e8cf96f5cc17a01e3cb869fee5a22a07c98384e698d2bf7d4",
      "src/nba_game_prediction/schedule.py": "b724a23fedd6486e4751b76e5c65bd3f60223ba0861045cb84a6c4357eef6000",
      "src/nba_game_prediction/sealed_access.py": "c46130423078ed75baa1dcd8fa24913e759073b150d1c729b1bf72b51cdf9814",
      "src/nba_game_prediction/seasons.py": "419fe5be87562acf488c00c9ffab58054ede156ed6143d25c0cd64d077ca68a8",
      "src/nba_game_prediction/stage1d.py": "4b87d1b28f15a1da2d6f4ffbf439ef9641ad15f4797d71a0d1c867df2879910a",
      "src/nba_game_prediction/stage3.py": "afceab6eba764aec0c66e03d300a77c9eb2beded767d8cee37956c9916fa164c",
      "src/nba_game_prediction/stage4.py": "b0fe361998ea7eb5e7ceb4d086b4e626d093f78bc998948cc14b0be70e4ac7d7",
      "src/nba_game_prediction/stage4a.py": "e0c9f7c8705ded00fd76abf4e1d855887b3b289263ed3d44c8746cf0b5470ae4",
      "src/nba_game_prediction/stage5.py": "516fc3d7d65e30441826b47b7ea58ee07b58b879d3b305c205395a81645a6c11",
      "src/nba_game_prediction/stage5_access.py": "6f416d53a896db58dbb77a933354be32a5c8c6664f4f2ea4c538651c94b31f34",
      "src/nba_game_prediction/stage5a.py": "7f50d240104d2c3cbd3b94e585f5b7666a656040bde0e867990712eb3847dbee",
      "src/nba_game_prediction/validate.py": "83dc96a38e620dbb5a3492c16bf46c11b04feead9cb4ce10214dc54dc4cd2c9a",
      "tests/test_00_development_policy.py": "85a17920e2e969e9598f8b8e16c0ccb8d54067b789e954c906a2d36e1a108d81",
      "tests/test_features.py": "c337945575963b19ddb185ae41d1ca2122e677c0baace2772ae8c0e0420359b0",
      "tests/test_ingestion.py": "bdc0303ac1ea9827d06e23dbf8dd98e01dd4bb56d769973053d7738b4b64a4a2",
      "tests/test_multiseason.py": "dab65bd577f6dbd6d5d20c7fe69fbc00b1c9732df04e3732fe98e4fa543dfe69",
      "tests/test_reconciliation.py": "d0f65a2a55404a6639e9eea7691e9a0d8cddf75e3cc828ab00b7aa75a227cbf1",
      "tests/test_sealed_access.py": "90d437d48ac627129965530ef7617e61df37e9a01d3693eb258284efa8330e87",
      "tests/test_stage5.py": "7335c90fe9b5e2c1e6e4ef7e3addb7f5fec5b079d6a64231d317ed0102ba591d",
      "tests/test_stage5a.py": "2b8733f14f11ae8a64a3a8033c0592a683a6cb9e6838cbcb423ce33e2c031489"
    }
  },
  "confirmatory_candidate_sha256": "279add1c7979c88306b0d8cdbe3b379a08b465531cc3324c7f29b646511f5ec5",
  "expected_dataset_scope": {
    "complete_season_required": true,
    "league": "NBA",
    "observed_games": null,
    "season": "2025-26",
    "season_type": "Regular Season"
  },
  "explicit_user_authorization": {
    "candidate_freeze_sha256": "aa9b7cabf805fb24b40327401e203cbfc74bf44448f8fa5c337db3c7791465d5",
    "final_freeze_sha256": "bf065ba3de945e86b85fb3ad3961cbd523cf319e6c7925e343be93adfe1ad191",
    "recorded_at_utc": "2026-09-24T20:22:51.076263+00:00",
    "saved_estimators_sha256": "26b17f2b08e2abff995b8760966c2498e247e01909ab8c4a03e2cda5c2635fb7",